{
  "created_at": "2026-10-20T00:00:00Z",
  "episode_id": "4bf974d9-e535-5031-8e5b-b1e7d75d88cf",
  "feedback_event_ids": [],
  "finding_ids": [
    "2a5b107a-4b35-56ba-b252-9e92bb02801e"
  ],
  "plan_id": "9e5892e3-f0ed-557b-9ea8-65202e9a6812",
  "remaining_budget_micro_usd": 4200000,
  "returns_to_gate2": true,
  "round_number": 1,
  "schema_version": "1.0",
  "steps": [
    {
      "action": "retime and retranslate cue c1 from actual audio",
      "category": "QA_CAPTIONS",
      "consumes_shot_attempt": false,
      "estimated_cost_micro_usd": 20000,
      "invalidates_asset_ids": [
        "13f3fa60-45e2-5a00-a6fa-2e0169b24c02"
      ],
      "recheck_check_ids": [
        "caption.critical_term_match"
      ],
      "step_id": "r1",
      "target": "CAPTION",
      "target_ids": [
        "c1"
      ]
    }
  ],
  "total_estimated_micro_usd": 20000,
  "trigger": "QA_FINDING"
}
